{
    "task_id": "TASK-0001",
    "work_item_revision": 1,
    "artifact_attempt": 1,
    "implementer_session_id": "session-20260813-usage-manual-root",
    "subject_base_commit": "3c86b5335d531b662e127bb5da6d8b442bf75af0",
    "subject_head_commit": "7e10dae772c07c03c29ea122d4e80a1e18d31262",
    "subject_diff_hash": "f8da6ed86a18043f59f80383eefe6a376b14103658d1f1afa1e0aa4e8b52237a",
    "deviations": [],
    "checks": [
        {
            "command": "PowerShell static manual content, path, README link, and git diff check",
            "result": "PASS",
            "evidence": "evidence/r001/implementation-checks.md"
        },
        {
            "command": "python tests/run_tests.py",
            "result": "PASS: 22/22",
            "evidence": "evidence/r001/implementation-checks.md"
        }
    ]
}
